Customer Name,Phone Number,Email Address,Company Name,City Name,Comments
Andrew Ramaswamy,9402871966,sachi52@example.com,Ratta PLC,Rohtak,Quisquam deserunt tempora error.
Chameli Mukhopadhyay,9079710872,yuvrajramanathan@example.com,"Kaur, Ratti and Palla",Eluru,Temporibus quam hic eaque doloribus qui animi deserunt.
Janaki Madan,9288506568,faqid45@example.org,Pall Group,Surat,Ratione natus beatae a mollitia ducimus dolorem iusto.
Tanish Das,9158289114,jairaj69@example.org,Khanna Ltd,Firozabad,Placeat vero rem consequuntur tempora ullam quia.
Niharika Sankar,9818233523,varenyadalal@example.org,"Om, Goel and Agate",Srikakulam,Voluptatum est nesciunt id facere veritatis voluptatum animi.
Gunbir Brahmbhatt,9598523436,xprabhakar@example.com,Agarwal Ltd,Gwalior,Quia quas officiis officia perferendis modi.
Barkha Kar,9697255817,dayamai84@example.com,Naik-Dube,Madanapalle,Necessitatibus magnam animi quaerat ea.
Ubika Ranganathan,9171809465,avnigola@example.net,Khosla LLC,Hubli–Dharwad,Perspiciatis optio delectus vitae similique.
Abhiram Raghavan,9149882604,onkar48@example.com,Tara-Kadakia,Jamshedpur,Quisquam reprehenderit libero assumenda blanditiis.
Hema Hegde,9254474117,svarkey@example.net,Nanda LLC,Surendranagar Dudhrej,Dolores ex eum reprehenderit quidem.
Victor Pillai,9347744144,anvi17@example.net,"Chander, Nazareth and Bhalla",Salem,Voluptatem laboriosam ut quasi tempore ratione cupiditate.
Robert Chawla,9451240938,prashadlibni@example.com,Gopal-Dani,Jehanabad,Quidem culpa eius suscipit pariatur dolor iure.
Chavvi Sekhon,9856650795,xboase@example.com,"Pathak, Borah and Ranganathan",Mau,Totam omnis accusamus.
Nicholas Chaudhuri,9747653333,katamanthan@example.com,Saxena Inc,Dhanbad,Temporibus repellendus consequatur reiciendis officiis atque fugit.
Wazir Sankar,9275369748,krishdevi@example.com,Upadhyay LLC,Madurai,Reiciendis alias magni id.
Vrinda Jani,9621514789,raksha70@example.net,Sangha-Vohra,Ongole,Voluptatem deleniti consequatur atque ipsa optio similique quidem.
Chameli Master,9224789436,noritara@example.com,"Rastogi, Dugar and Rege",Dindigul,Eum et aliquid accusantium.
Zinal Bhandari,9115980629,ayushman92@example.com,Koshy-Pingle,Dewas,Molestias sed at enim.
Aryan Randhawa,9396890417,sharmavarenya@example.org,Hari-Bhagat,Satara,Nemo consequuntur quae sunt dicta delectus animi.
Parth Sur,9598280434,vasatika40@example.org,"Sekhon, Gopal and Sura",Mysore,Aliquam incidunt velit expedita aut saepe magnam.
Niharika Loyal,9133447968,fsachdeva@example.net,Krishna-Biswas,Buxar,Consequuntur id blanditiis.
Lajita Setty,9619442413,anvi43@example.com,"Kannan, Rajagopal and Jhaveri",Thiruvananthapuram,Et at id ut commodi voluptate.
Jagat Mammen,9970512724,anika92@example.net,Kota-Naik,Tiruppur,A nisi itaque vitae.
Oscar Bhattacharyya,9530874620,wdin@example.net,"Gill, Loke and Mangal",Dehradun,Vero ipsa doloribus sit repudiandae ex vero.
Meera Gandhi,9143538529,xshukla@example.net,Sahni-Palan,Dehradun,Tempore provident consectetur nemo tenetur animi.
Arin Bumb,9636584643,udarsh77@example.com,Iyer-Krish,Bikaner,Quia cumque nostrum est similique magni necessitatibus.
Max Goswami,9443355289,vrindabali@example.org,Buch and Sons,Jehanabad,Adipisci omnis commodi.
Ekta Soni,9998852451,rishi99@example.com,Tella-Kanda,Patna,Magnam deserunt voluptate quam beatae dolor.
Nathaniel Sahni,9855441307,swamyeiravati@example.net,Balasubramanian-Ganguly,Khammam,Autem voluptate aperiam a ut distinctio.
Sai Mital,9483890446,daliaunni@example.com,Joshi Inc,Katihar,Alias ullam error facilis.
Wriddhish Nagi,9879117845,irastogi@example.net,Solanki Inc,Salem,Odit totam sed ea sunt distinctio.
Sarthak Mall,9870831072,mohammedaurora@example.net,Virk Ltd,Udaipur,Repudiandae tempore corporis fugit quisquam provident distinctio.
Vivaan Sodhi,9200192473,vedikabhattacharyya@example.net,Mangat-Padmanabhan,Berhampore,Vel optio molestias.
Brijesh Korpal,9544944079,ekaraj46@example.net,Pathak-Gade,Tezpur,Reiciendis temporibus molestias est harum.
Sudiksha Varkey,9721594479,kalpit59@example.com,Pathak-Setty,Faridabad,Ullam doloribus vel dolor voluptatum.
Harshil Sagar,9296876165,creddy@example.net,Balasubramanian Inc,Davanagere,Expedita nobis at ad necessitatibus enim corrupti.
Chameli Raval,9496184910,shivanshoommen@example.org,Jhaveri Inc,Aurangabad,Nam reiciendis exercitationem esse.
Harrison Gaba,9820997368,qatwal@example.net,"Bakshi, Prabhakar and Krishnan",Jalgaon,Accusamus hic minus.
Ikshita Grewal,9400577534,baradmohammed@example.net,"Bhakta, Modi and Dara",Pondicherry,Fugit accusantium facilis ut assumenda fugit nobis.
Triya Tiwari,9019922642,wazir62@example.org,Wali-Wason,Sagar,Iste impedit qui reprehenderit.
Anamika Warrior,9913109749,nshukla@example.org,"Dugal, Mangal and Chahal",Firozabad,Quia blanditiis commodi recusandae suscipit quibusdam quibusdam culpa.
Faras Hayre,9608920217,samar97@example.org,Chandra-Nagy,Kollam,Aperiam voluptatibus expedita accusantium laborum ullam iusto.
Matthew Modi,9344448445,narangneelima@example.org,"Dave, Kata and Oza",Bhilai,Commodi officia expedita veritatis.
Veer Mitra,9845791584,ushanker@example.net,Vala PLC,Anantapur,Perspiciatis labore fugit id quasi.
Bachittar Lal,9996846058,yashvi47@example.net,Sachdeva PLC,Dhule,Harum vitae sunt possimus corporis a dolore.
Maanas Mohan,9255386490,lajita52@example.net,Bhardwaj Ltd,Ajmer,Hic neque possimus.
Vritti Behl,9365301602,sathviksaxena@example.org,Bawa Inc,Begusarai,Quo nobis ipsum doloribus illo.
Sai Jain,9086136374,adesai@example.net,"Hora, Kashyap and Borra",Hazaribagh,Dolores beatae nostrum libero labore aliquam magni.
Vedika Rai,9459377817,darika63@example.net,Srinivas-Kari,Hazaribagh,Dolor at iusto quaerat voluptatibus occaecati.
Krisha Datta,9397790500,iom@example.com,Chandran Inc,Cuttack,Tempore accusantium deserunt in iure sunt.
Anjali Brar,9597972507,krishadey@example.net,Varkey LLC,Tirunelveli,Voluptas vel dicta aliquid dolore neque hic cumque.
Jyoti Kari,9981878870,chaudhurialexander@example.com,Ahuja Inc,Ludhiana,Debitis tempora impedit voluptatum corrupti.
Anjali Bath,9745385000,imohanty@example.net,Halder-Menon,Bikaner,Excepturi aperiam perspiciatis ex maxime.
Aarna Wadhwa,9519946984,sarkarsachi@example.com,"Kurian, Thaker and Pillai",Parbhani,Soluta nulla consequatur sed.
Upasna Bhatt,9193512363,riyalalla@example.com,"Sandal, Zacharia and Sura",Munger,Id architecto sequi iure nihil.
Hritik Shankar,9830890584,chadharyan@example.net,"Panchal, Mukherjee and Vaidya",Sultan Pur Majra,Odit consectetur placeat adipisci.
Jai Bawa,9461410832,bimala14@example.net,Garg Group,Hazaribagh,Cumque enim maiores fugiat eveniet tempore.
Hemani Sanghvi,9206961124,parth53@example.com,Datta-Balay,Udaipur,Quibusdam voluptates aspernatur quod ex culpa repudiandae.
Zayyan Butala,9816172768,vrama@example.org,Pant PLC,Rajkot,Natus laudantium blanditiis.
Inaya Shere,9632798911,tellavyanjana@example.org,Mital-Misra,Junagadh,Natus exercitationem itaque reprehenderit dolores ratione.
Balvan Pillay,9344811799,awason@example.org,Bera PLC,Gaya,Deserunt cumque animi saepe at debitis nam.
Irya Mane,9958699496,adityakumar@example.com,Chatterjee-Wali,Amaravati,Soluta commodi officia fugit.
Advika Wadhwa,9812605757,coommen@example.com,Memon-Rama,Junagadh,Vero culpa cupiditate.
Chaaya Lal,9903410316,wratti@example.net,"Maharaj, Patla and Sundaram",Serampore,Tempore delectus natus fugit ut non a repellat.
Mohammed Bora,9572460487,zthaker@example.net,Chad-Gour,Avadi,Vel dolor corrupti alias ipsam debitis.
Saksham Varughese,9628234619,thamankevin@example.org,"More, Dalal and Gandhi",Vadodara,Error saepe ipsa nobis odio odit.
Aradhana Dutta,9563670700,vyanjana62@example.com,Sura-Parmar,Agra,Voluptate ipsum dignissimos cupiditate in.
Bhavika Golla,9561263348,riakrishna@example.net,Mitra-Edwin,Raurkela Industrial Township,Perspiciatis consectetur eos aliquid fugit sequi officiis.
Mitali Ramakrishnan,9893308930,lilabassi@example.org,"Nath, Chana and Sanghvi",Jamshedpur,Odit alias incidunt illo.
Januja Vohra,9715469075,horafiyaz@example.com,Sharma Inc,Chinsurah,Unde quisquam libero vero illum.
Devansh Borra,9113758240,radhika02@example.org,Prabhakar-Iyer,Tiruvottiyur,Incidunt soluta debitis perferendis.
Chanakya Verma,9409854142,inayaseshadri@example.org,Nanda Inc,Salem,Placeat accusantium eius quidem.
Chameli Saxena,9662486563,elijah12@example.org,"Munshi, Patla and Gala",Guna,Quasi nostrum tempora.
Dhruv Saini,9541128197,wbahl@example.com,Varghese Inc,Kadapa,Necessitatibus cum quas minima suscipit.
Lekha Borra,9747665811,avarughese@example.org,Kibe-Kaur,Ludhiana,Ad sequi provident aperiam iste at ducimus.
Gauri Sha,9588822559,omkaarsaraf@example.net,"Chowdhury, Shanker and Vaidya",Singrauli,Placeat fuga odit velit deserunt.
Krishna Divan,9960803507,tshankar@example.org,Cherian-Garde,Dindigul,Nobis libero tempore quo.
Ranveer Bahl,9229250903,sethgeorge@example.net,Jhaveri-Pant,Rajahmundry,Occaecati hic neque.
Wakeeta Barman,9613424965,upkaarkalla@example.com,Khare-Karpe,Patna,Harum occaecati magnam quidem architecto nulla deleniti.
Urvi Vohra,9017988219,kritikavig@example.com,Seth Group,Munger,Quae reiciendis error doloribus commodi ut magnam.
Samarth Seshadri,9649492119,reva30@example.com,"Hari, Radhakrishnan and Jani",Aizawl,Doloremque eligendi ullam.
Zansi Sharma,9367026994,yashodhara19@example.net,Mital-Rao,Sirsa,Similique laborum exercitationem velit aspernatur nesciunt.
Yashodhara Roy,9601221252,ramafariq@example.net,"Raval, Singh and Varughese",Dewas,Fuga officiis pariatur.
Turvi Sachar,9955137572,munijasmit@example.net,Panchal-Issac,Anand,Praesentium saepe maxime delectus unde.
Tanay Venkataraman,9599707660,widishashan@example.net,Banerjee-Apte,Ozhukarai,Fugiat nesciunt perferendis distinctio minima recusandae voluptatem.
Anthony Divan,9550205839,pinglenihal@example.net,Sen Ltd,Sultan Pur Majra,Atque sint saepe voluptatem.
Ranveer Kota,9967303071,amisra@example.net,Mishra-Kamdar,Anand,Deserunt iusto repellat labore.
Dayita Lad,9316679794,bbrahmbhatt@example.org,Gokhale Inc,Chittoor,Perspiciatis accusantium ab repellendus.
Krisha Narasimhan,9535985198,batrafalak@example.com,Bose PLC,Avadi,Voluptate quo id fugit excepturi soluta reprehenderit pariatur.
Zashil Rau,9460631421,iryabhagat@example.net,Chhabra LLC,Shahjahanpur,Atque alias nihil esse rem quis.
Udyati Bhavsar,9988129644,zansipuri@example.org,"Panchal, Mangal and Walia",Howrah,Quasi distinctio harum labore cumque incidunt.
Vrishti Bajaj,9398323345,keerrajata@example.net,"Hegde, Ratti and Choudhury",Shivpuri,Facere facere quasi aliquid optio.
Zashil Vig,9357114291,tejaslalla@example.net,Bansal Group,Katihar,Harum voluptatibus officiis quae.
Jyoti Agrawal,9988570122,yashkibe@example.org,"Mody, Mutti and Bhatt",Ichalkaranji,Veniam porro delectus suscipit atque autem.
Ekalinga Din,9142728678,wridesh11@example.net,Palla-Shenoy,Orai,Ad eos quo rerum aliquam iusto.
Pratyush Mall,9796036653,harini79@example.net,"Bhatti, Tailor and Pradhan",Meerut,Eum saepe atque maxime hic.
Manbir Sridhar,9805028355,hbassi@example.org,Dugar-Mall,Kavali,Fugit aut voluptatem ex nesciunt animi.
Warinder Pau,9970850987,kamala18@example.net,Ray-Sarkar,Rajpur Sonarpur,Commodi aspernatur deleniti ex enim.
Farhan Setty,9075561554,sachdevudarsh@example.org,Sridhar-Nori,Jalandhar,Veniam nesciunt impedit ab incidunt nemo nesciunt.
Ekiya Apte,9483813819,aadiwagle@example.org,Batta Ltd,Rewa,Cumque rem eaque laborum consequatur aspernatur ad.
